{
  "messageId": "550e8400-e29b-41d4-a716-446655440000",
  "messageType": "CreateCustomerInERP",
  "messageVersion": "1.0",
  "sourceSystem": "CRM",
  "targetSystem": "BC",
  "correlationId": "6ba7b810-9dad-11d1-80b4-00c04fd430c8",
  "occurredAt": "2026-06-19T08:30:00Z",

  "replyTo": {
    "queue": "sbq_crm"
  },

  "payload": {
    "customer": {
      "customerId": "9c858901-8a57-4791-81fe-4c455b099bc9",
      "name": "Example Customer GmbH",
      "vatNumber": "ATU12345678",
        "addresses": [
        {
        "addressType": "Invoice",
        "street": "Musterstraße 1",
        "postalCode": "6020",
        "city": "Innsbruck",
        "countryCode": "AT"
        }
        ]
    }
  }
}